place_id,name,rating,lat,lng,type,review_text,review_rating,review_time,review_author
ChIJ8x6YczxTqEcR5oK51Kc1n8Q,DHL Packstation 157,3.9,52.5644728,13.3297405,DHL Packstation,"Gestern am 3.12.2025, 21:45 da gewesen um Pakete abzuholen .DEFEKT!!!
Heute 04.12.2025 , 8:40 : DEFEKT!!!
Email an DHL geschickt, habe auch umgehend Feedback bekommen das sich drum gekümmert wird!
Erneut um 11:15 dagewesen: DEFEKT‼️😡😡😡
Was nun? Freue mich über Geistesblitze!!😀",2,vor 4 Monaten,Stefan Zecha
ChIJ8x6YczxTqEcR5oK51Kc1n8Q,DHL Packstation 157,3.9,52.5644728,13.3297405,DHL Packstation,Packstation erneut defekt ich versuche seit gestern meine Pakete da rauszuholen!!! 🤷‍♂️,1,vor 4 Monaten,son0
ChIJ8x6YczxTqEcR5oK51Kc1n8Q,DHL Packstation 157,3.9,52.5644728,13.3297405,DHL Packstation,"Alles läuft super, wenn man die Nummer hat und das Paket hier landet und nicht 5 Busstationen weiter...",5,vor einem Jahr,Maureen Lorenz
ChIJ8x6YczxTqEcR5oK51Kc1n8Q,DHL Packstation 157,3.9,52.5644728,13.3297405,DHL Packstation,Alles super. Nur das Wetter stört ein bisschen. Man kann kaum den Bildschirm erkennen wenn die Sonne scheint.,4,vor 2 Jahren,Petra Grundmann
ChIJ8x6YczxTqEcR5oK51Kc1n8Q,DHL Packstation 157,3.9,52.5644728,13.3297405,DHL Packstation,"Ich fand toll so ein Packstation auf Lidl Parkplatz.
Gleich einkaufen und Sendung abholen",5,vor 2 Jahren,N.B.A The best of the west
ChIJi3MZpEFTqEcREMBj4zbOXRo,DHL Packstation 135,4.2,52.5652881,13.3279002,DHL Packstation,Bei dieser Packstation bin ich vor allem von der Überdachung begeistert. So werden bei Regen die Pakete nicht nass.,5,vor 2 Jahren,Philipp Nitzsche
ChIJi3MZpEFTqEcREMBj4zbOXRo,DHL Packstation 135,4.2,52.5652881,13.3279002,DHL Packstation,"Auch bei Regen kann man seine Pakete trocken abholen. Man parkt direkt vor den Fächern und setzt dann nur zurück, um weiterzufahren.",5,vor einem Jahr,Birgit Prehn
ChIJi3MZpEFTqEcREMBj4zbOXRo,DHL Packstation 135,4.2,52.5652881,13.3279002,DHL Packstation,Große Packstation mit Funktion zum Drucken der Paketmarken. Parken ist auch wunderbar möglich. Hat bisher immer alles geklappt und die Station scheint nie allzu voll zu sein.,5,vor 4 Jahren,Sara G.
ChIJi3MZpEFTqEcREMBj4zbOXRo,DHL Packstation 135,4.2,52.5652881,13.3279002,DHL Packstation,Drucker zeigt an das es gedruckt hat aber es kommt kein Etikett raus. Stornieren geht auch nicht da das Etikett angeblich gedruckt wurde. Nun muss ich sehen wie ich rückerstattet kriege,1,vor 4 Jahren,H B
ChIJi3MZpEFTqEcREMBj4zbOXRo,DHL Packstation 135,4.2,52.5652881,13.3279002,DHL Packstation,Schön hell erleuchtet. Man steht im trockenen. Super Erfindung diese Box. Man kommt 24 Stunden an seine Pakete.,5,vor einem Jahr,Petra Grundmann
ChIJIRmVZcpTqEcRmhUPbFEWWcU,DHL Packstation 156,3.9,52.5646131,13.3355856,DHL Packstation,"Ständig voll! Es wurden schon mehrere meiner Pakete einfach wieder zurück geschickt, weil voll! Anstatt die pakete einfach zum nächsten Shop oder zur nächsten Packstation zu bringen! Sehr Ärgerlich!",1,vor 3 Jahren,son0
ChIJIRmVZcpTqEcRmhUPbFEWWcU,DHL Packstation 156,3.9,52.5646131,13.3355856,DHL Packstation,Bequem und nah. Gut wenn man nicht Zuhause ist oder nicht bei der Post anstehen will.,5,vor 2 Jahren,Oliver Schlör
ChIJIRmVZcpTqEcRmhUPbFEWWcU,DHL Packstation 156,3.9,52.5646131,13.3355856,DHL Packstation,"Gut erreichbar, ausreichend groß und bisher hat sie immer funktioniert.",5,vor 9 Jahren,Mathias Nicolai
ChIJIRmVZcpTqEcRmhUPbFEWWcU,DHL Packstation 156,3.9,52.5646131,13.3355856,DHL Packstation,"Mit DHL habe ich ein Problem mit
Passwörter.
Mal werden die anerkannt Mal nicht.",3,vor 3 Jahren,Falcon Falcone
ChIJIRmVZcpTqEcRmhUPbFEWWcU,DHL Packstation 156,3.9,52.5646131,13.3355856,DHL Packstation,Zuverlässige Station in guter Lage direkt an der Tankstelle.,5,vor 10 Jahren,Michael Ballentin
ChIJJV-0GntTqEcRGjLsSQkEBfE,DHL Packstation 163,1,52.5660874,13.3250541,DHL Packstation,"Schön entlegen diese Packstation. Zu Fuß gute 15 Min. (Bei mir in der Nähe fußläufig drei Postshops). Parkplätze sind nicht vorhanden. Busse fahren dort auch nicht. Das Postkunden kein Auto haben ist offensichtlich nicht vorgesehen. Schön, dass man trotz Zustellgebühren selbst tätig werden muss. Ist nicht amüsant.",1,vor 2 Monaten,MoFa
ChIJJV-0GntTqEcRGjLsSQkEBfE,DHL Packstation 163,1,52.5660874,13.3250541,DHL Packstation,"Ist echt nervig, dass man wegen der Einbahnstraße einmal quer durch die Siedlung fahren muss, nur weil die Packstation 153 entweder überfüllt oder kaputt war.",1,vor 3 Monaten,Birgit Prehn
ChIJGXi6HYlTqEcRUL1B8VpfcIo,DHL Packstation 269,4,52.565496,13.3214161,DHL Packstation,"Ich vergebe nur 3 Sterne, weil ein Computer für die schnellere Rücksendung von Paketen hilfreich wäre und Erstabholer auf eine Bestätigungsmail warten müssen. Positiv ist die Nähe zu einer Bushaltestelle und einem Internetcafé.",3,vor einer Woche,Bartek Maciej Stroz
ChIJGXi6HYlTqEcRUL1B8VpfcIo,DHL Packstation 269,4,52.565496,13.3214161,DHL Packstation,,5,vor 12 Monaten,Veronika S.
ChIJLwSXYKxTqEcR1aehl7W0BfQ,DHL Packstation 137,3.6,52.5767234,13.3257838,DHL Packstation,"Ist das eine neue Masche von DHL?
Wer hat euch die Erlaubnis erteilt die Sendung an einer Appgesteuerten Packstation abzulegen.
Der Service wird immer schlechter, die Pakete immer teurer, der Kunde hat die Lauferei.",1,vor 4 Monaten,Jürgen Dombrowski
ChIJLwSXYKxTqEcR1aehl7W0BfQ,DHL Packstation 137,3.6,52.5767234,13.3257838,DHL Packstation,Bin ich nicht zufrieden dauert lange bis man an sein Paket kommt,3,vor 2 Jahren,Cathrin Brügge
ChIJLwSXYKxTqEcR1aehl7W0BfQ,DHL Packstation 137,3.6,52.5767234,13.3257838,DHL Packstation,"Gut erreichbar , auch Parkplätze vorhanden 😎",5,vor einem Jahr,Michael Krone
ChIJLwSXYKxTqEcR1aehl7W0BfQ,DHL Packstation 137,3.6,52.5767234,13.3257838,DHL Packstation,"Ich bin verwundert , da war ich gar nicht !?!?! 🤷‍♀️",1,vor 2 Jahren,hab kein
ChIJLwSXYKxTqEcR1aehl7W0BfQ,DHL Packstation 137,3.6,52.5767234,13.3257838,DHL Packstation,Gute İdee von DHL,5,vor 2 Jahren,Esenevler Ümraniye
ChIJLUAzmo9TqEcRG-mLYVxncWE,DHL Packstation 228,4.3,52.57953149999999,13.3352944,DHL Packstation,"! ACHTUNG DEFEKT ! Display zeigt an, das sich dass Fach öffnet aber es öffnet sich nicht. Anschliessend zeigt die Packstation die Sendung als entnommen an (auch online) . Nochmaliges Öffnen des Faches ist NICHT möglich. Der Kundenservice kann nix tun außer einen darauf zu verweisen das man sich mit dem Versender in Kontakt setzen soll damit dieser einen Nachforschungsauftrag stellt.
Mal sehen ob ich jetzt 57 EUR in den Sand gesetzt hab.
Ich rate von weiterer Verwendung der Station ab.",1,vor 5 Jahren,Martin Repke
ChIJLUAzmo9TqEcRG-mLYVxncWE,DHL Packstation 228,4.3,52.57953149999999,13.3352944,DHL Packstation,Bis jetzt immer alles wunderbar geklappt das Display spinnt momentan ein wenig wenn man unterschreiben möchte kommen nur Punkte. Aber sonst alles perfekt und zuverlässig.,5,vor 4 Jahren,Reeasy
ChIJLUAzmo9TqEcRG-mLYVxncWE,DHL Packstation 228,4.3,52.57953149999999,13.3352944,DHL Packstation,Durch den Parkplatz quasi eine Drive-In-Packstation: Für mich sehr praktisch.,5,vor 10 Jahren,Oliver Wolters
ChIJLUAzmo9TqEcRG-mLYVxncWE,DHL Packstation 228,4.3,52.57953149999999,13.3352944,DHL Packstation,Sehr gut erreichbar und ist von zwei Seiten anfahrbar.,5,vor 5 Jahren,Deniz Oral
ChIJLUAzmo9TqEcRG-mLYVxncWE,DHL Packstation 228,4.3,52.57953149999999,13.3352944,DHL Packstation,"Hat prima geklappt.
Kann ich nur weiterempfehlen.",5,vor 6 Jahren,Meinhotte
ChIJ8evG5_1TqEcR6eiBUezJg2Q,DHL Packstation 262,4,52.560389,13.3322361,DHL Packstation,"Achtung, derzeit (Stand 17.06.2025) ist diese Packstation 262 defekt! Bitte auch melden nach Login auf dhl.de unter ""Hilfe und Kontakt"" -> ""Packstation"" -> ""Probleme & Lösungen"" -> runterscrollen zu ""Hier geht es zum Kontakt"" -> ""Schreiben Sie uns""",4,vor 9 Monaten,Sinan Recber
ChIJ8evG5_1TqEcR6eiBUezJg2Q,DHL Packstation 262,4,52.560389,13.3322361,DHL Packstation,"75 % meiner Pakete an diese Packstation wurden an irgendwelchen, bis 1,5 km entfernten Packstationen abgelegt.",3,vor einem Jahr,Dirk S
ChIJ8evG5_1TqEcR6eiBUezJg2Q,DHL Packstation 262,4,52.560389,13.3322361,DHL Packstation,"Wenn man die Packstation gefunden gut. Sauber, nicht beschmiert",4,vor 9 Monaten,Katharina Weber
ChIJ8evG5_1TqEcR6eiBUezJg2Q,DHL Packstation 262,4,52.560389,13.3322361,DHL Packstation,,4,vor 3 Monaten,Dzhyuneyt Hyusein
ChIJ8evG5_1TqEcR6eiBUezJg2Q,DHL Packstation 262,4,52.560389,13.3322361,DHL Packstation,,5,vor 6 Monaten,Lami Mustafa Şahin
ChIJzxygSpJTqEcR5bksQ8LihP0,DHL Packstation 609,4.3,52.576299,13.3145657,DHL Packstation,"Das ist eine wirklich tolle Packstation, man kann fix mit dem Auto ran fahren und das Touchpad funktioniert perfekt.",5,vor 4 Jahren,Philipp Nitzsche
ChIJzxygSpJTqEcR5bksQ8LihP0,DHL Packstation 609,4.3,52.576299,13.3145657,DHL Packstation,Super 👌,5,vor einem Jahr,Kasia Stopa
ChIJzxygSpJTqEcR5bksQ8LihP0,DHL Packstation 609,4.3,52.576299,13.3145657,DHL Packstation,,5,vor 5 Monaten,Aman Bakri
ChIJzxygSpJTqEcR5bksQ8LihP0,DHL Packstation 609,4.3,52.576299,13.3145657,DHL Packstation,,4,vor 8 Monaten,aneta hartmann
ChIJzxygSpJTqEcR5bksQ8LihP0,DHL Packstation 609,4.3,52.576299,13.3145657,DHL Packstation,,1,vor einem Jahr,Rainer Eichhorst
ChIJTbqMn9pVqEcRByh0v7E9exU,DHL Packstation 408,5,52.571121,13.3066161,DHL Packstation,"Die Station war gut zu finden die Bedienung war auch OK, mit der Anleitung vom Brief was wir zugeschickt bekommen haben. Ging schnell und unkompliziert. Auf dem Weg zur Packstation haben wir eine gesehen die war näher an unsere Adresse, da haben wir uns gefragt warum unser Päckchen nicht da rein gemacht wurde.  Sonst alles supi",5,vor einer Woche,Cyndi Hoffmann
ChIJTbqMn9pVqEcRByh0v7E9exU,DHL Packstation 408,5,52.571121,13.3066161,DHL Packstation,,5,vor 2 Wochen,Arnold Arbuz
ChIJ2-3WuGtTqEcRcvEJ9bAhgZ0,DHL Packstation 233,5,52.5698453,13.3495777,DHL Packstation,,5,vor einem Monat,Gökmen Y.
ChIJ2-3WuGtTqEcRcvEJ9bAhgZ0,DHL Packstation 233,5,52.5698453,13.3495777,DHL Packstation,,5,vor einem Jahr,Katja Wegner
ChIJn32nNIZPqEcRYvPIpU_ednU,DHL Packstation 420,3.4,52.5808726,13.3470331,DHL Packstation,"Der QR Code lässt sich nicht scannen. Statt dessen muss man den 10 Stelligen Code e eingeben. Einen Fortschritt gegenüber Karte scannen und 4 Stelligen Zahlencode eingeben kann ich nicht erkennen.
Schade",3,vor 4 Jahren,Christian Richter
ChIJn32nNIZPqEcRYvPIpU_ednU,DHL Packstation 420,3.4,52.5808726,13.3470331,DHL Packstation,"Katastrophe, es funktioniert gar nichts. Und, ich bin dort nicht zum ersten Mal. Da dort nie etwas richtig funktioniert hat, bin ich zu einem sogenannten Späti gegangen, nun hat der zu gemacht und das Theater geht von vorn los.",1,vor 2 Jahren,Silvia
ChIJn32nNIZPqEcRYvPIpU_ednU,DHL Packstation 420,3.4,52.5808726,13.3470331,DHL Packstation,Alles perfekt,5,vor 2 Jahren,Simon Graf von Brühl
ChIJn32nNIZPqEcRYvPIpU_ednU,DHL Packstation 420,3.4,52.5808726,13.3470331,DHL Packstation,Diese Packstation existiert nicht mehr!!!,1,vor 3 Wochen,Michael Bud.
ChIJn32nNIZPqEcRYvPIpU_ednU,DHL Packstation 420,3.4,52.5808726,13.3470331,DHL Packstation,Gute übliche Packstation.,3,vor 4 Jahren,Quang Dang
ChIJlTBumYVTqEcRtV1mAnpCXJU,DHL Packstation 206,3.5,52.57038250000001,13.307359,DHL Packstation,Wie jede Stelle simpel und einfach.mehr ist es nicht.,3,vor 6 Monaten,Sven Hochhaus
ChIJlTBumYVTqEcRtV1mAnpCXJU,DHL Packstation 206,3.5,52.57038250000001,13.307359,DHL Packstation,Funktioniert einwandfrei :),5,vor einem Jahr,A. R.J
ChIJlTBumYVTqEcRtV1mAnpCXJU,DHL Packstation 206,3.5,52.57038250000001,13.307359,DHL Packstation,,1,vor 9 Monaten,Julia P.
ChIJlTBumYVTqEcRtV1mAnpCXJU,DHL Packstation 206,3.5,52.57038250000001,13.307359,DHL Packstation,,5,vor einem Jahr,Marco Reimer
ChIJz4ZVZ0NTqEcRz0BZ__6Rq4I,DHL Packstation 216,3.3,52.55499,13.3378801,DHL Packstation,"Warum wurde mein Paket in eine Packstation geliefert, obwohl ich weder eine Benachrichtigungskarte noch die DHL-App habe? Wie soll ich mein Paket abholen, wenn mir der Abholcode nicht mitgeteilt wurde? Warum wurde das Paket nicht einfach in einen Paketshop gebracht, wo eine Abholung ohne App oder Code möglich ist?

Ich bitte um eine klare Erklärung, wie ich in einem solchen Fall an meine Sendung kommen soll. Dieses Vorgehen ist absolut unverständlich und nicht kundenfreundlich.",1,vor 12 Monaten,Andrii O.
ChIJz4ZVZ0NTqEcRz0BZ__6Rq4I,DHL Packstation 216,3.3,52.55499,13.3378801,DHL Packstation,Hab da schon 4 mal Sachen hinbestellt die gingen immer zum Absender zurück!! Die ersten drei male war sie auch inaktiv glaub ich aber jetzt leuchtet das Licht an der Station sogar und ich dachte sie geht endlich aber ne. was soll das?,1,vor 2 Jahren,Janis S.
ChIJz4ZVZ0NTqEcRz0BZ__6Rq4I,DHL Packstation 216,3.3,52.55499,13.3378801,DHL Packstation,"Die DHL Packstation 216 in der Togostraße war super einfach. Die App zeigte alles übersichtlich an, die Abholung ging schnell und mein Kind war begeistert von dem kleinen Park in der Nähe.",5,vor 7 Monaten,Sathya Appuraj
ChIJz4ZVZ0NTqEcRz0BZ__6Rq4I,DHL Packstation 216,3.3,52.55499,13.3378801,DHL Packstation,,5,in der letzten Woche,nate22i
ChIJz4ZVZ0NTqEcRz0BZ__6Rq4I,DHL Packstation 216,3.3,52.55499,13.3378801,DHL Packstation,,3,vor einem Monat,Jörg Cordes
ChIJvXMPwbtTqEcRwm2P1c28yGE,DHL Packstation 247,3.3,52.57380509999999,13.355179,DHL Packstation,"Wichtig: Nur per App bedienbar, sofern diese vorab freigeschaltet wurde (man muss nach erster Registrierung einen Brief abwarten mit QR Code!)

Häufig voll. Gerade zu Stoßzeiten wie Weihnachten häufig zu voll, weshalb Pakete dann ziemlich weit weg in der Station 420 bei Aldi landen. Ansonsten toll, dass es hier endlich wenigstens eine kleine Station gibt (war wirklich höchste Zeit für diese Gegend)",4,vor einem Monat,Charly Saß
ChIJvXMPwbtTqEcRwm2P1c28yGE,DHL Packstation 247,3.3,52.57380509999999,13.355179,DHL Packstation,"Stehe regelmäßig 15 Minuten davor und sie lässt sich nicht öffnen. Bluetooth Verbindung funktioniert völlig willkürlich. Schon so oft wurden Pakete zurückgeschickt, weil sich das Ding nicht öffnen ließ. Zumindest ein Bildschirm wäre nützlich, um einen Workaround für die App zu haben. So ist die Station einfach komplett untauglich.",1,vor 5 Monaten,Krissi
ChIJvXMPwbtTqEcRwm2P1c28yGE,DHL Packstation 247,3.3,52.57380509999999,13.355179,DHL Packstation,"Top Ablauf. Keine Probleme. (Lediglich ein gutaussehender Paketbote hat die zeitgerechte Entnahme etwas verzögert, aber sehen wir da mal drüber hinweg lol)",5,vor einem Monat,Michelle Weise
ChIJzzmn0pJTqEcRTHqo5Q1Pumk,DHL Packstation 194,5,52.5854201,13.3271591,DHL Packstation,,5,vor 11 Monaten,Marco Reimer
ChIJ86Cam9RRqEcRJeLofljMMGc,DHL Packstation 246,2.5,52.5500123,13.3412948,DHL Packstation,"Da will man nur sein Paket abholen und muss dafür erstmal Minutenlang die DHL App einrichten und auch noch so eine bescheuerte Video-Verifizierung machen. Noch nie so eine kundenunfreundliche und umständliche Paketabholung erlebt. Kann jetzt erstmal wieder nach Hause, um die Verifizierung zu machen.",1,vor 3 Monaten,der taubenhaucher
ChIJ86Cam9RRqEcRJeLofljMMGc,DHL Packstation 246,2.5,52.5500123,13.3412948,DHL Packstation,Sendung wurde an die falsche Station geliefert.  Diese funktioniert nur mit Bluetooth und damit ist meine Sendung im chaos der DHL verloren.,1,vor 5 Monaten,Tim Olk
ChIJ86Cam9RRqEcRJeLofljMMGc,DHL Packstation 246,2.5,52.5500123,13.3412948,DHL Packstation,"Wie kann man 2 Packstationen innerhalb Berlins die gleiche Nummer geben, wie blöd ist das? Zweite Frage warum muss man eine Postleitzahl angeben, wenn es den Paketboten nicht interessiert ? Ich wohne in Charlottenburg und soll in den Wedding fahren für ein Paket. Typisch DHL... völlig Planlos. Eigentlich wären 0 Sterne richtig, geht leider nicht.",1,vor einem Jahr,Marlene S.
ChIJ86Cam9RRqEcRJeLofljMMGc,DHL Packstation 246,2.5,52.5500123,13.3412948,DHL Packstation,"Für diese Station wird man gezwungen eine App runter zu laden, DHL Kundenservice hilft nur auf gut Glück Pakete umzuleiten - klarer Fall für den Verbraucherschutz!",1,vor einem Jahr,H. E.
ChIJ86Cam9RRqEcRJeLofljMMGc,DHL Packstation 246,2.5,52.5500123,13.3412948,DHL Packstation,"Ich Frage mich warum DHL 2 Packstationen mit gleicher Bezeichnung im Plan hat. Muss ich nach Charlottenburg fahren obwohl ich im Wedding wohne. Dem Computer der DHL und dem Fahrer ist das egal. Kleine Sache, große Wirkung",1,vor 2 Jahren,Stephan S.
ChIJx_j-QMJTqEcR_Fyz91q4-1k,DHL Packstation 193,5,52.5859829,13.3287364,DHL Packstation,"Packstation direkt auf dem Parkplatz, nur per App bedienbar.",5,vor einem Monat,Lisa Müller
ChIJwdFmVZlTqEcRmo2JYz4Fia0,DHL Packstation 606,4.2,52.5861418,13.3422716,DHL Packstation,"Wird von DHL selten angefahren/ entleert. Scheint hier in Reinickendorf üblich...Könnte  besser beleuchtet sein. In der dunklen Jahreszeit wirklich gruselig der Parkplatz hier.

Die Bilder sind übrigens von der Packstation 123 bei Rewe, ca 400 Meter weiter nördlich. Diese hier, nämlich die 606 befindet sich hinter Lidl. Hier gibt es auch keinen Briefmarkenautomat. Falls den einer hier vermutet wegen den falschen Bildern.",3,vor 4 Jahren,Mano W.
ChIJwdFmVZlTqEcRmo2JYz4Fia0,DHL Packstation 606,4.2,52.5861418,13.3422716,DHL Packstation,"Bei Einlieferung eines vorfrankierten Pakets wird die Quittung nicht mehr automatischj auf Wunschteaste ausgestellt. Man kann nur noch wählen, ob man keine Quittung wünscht oder deren Zusendung per E-Mail. Die Eingabetastur ist aber vollständig ""schräg justiert""...Es ist mir dreimal (!) nicht gelungen, meine E-Mail erfolgreich einzugeben. Da man das eingelegte Paket n i c h t  wieder heraus gegeben bekommt, muss man,  um den Vorgang abschließen zu können, auf Verzicht der Quittung drücken und erhält so keinen Nachweis der Absendung. Das halte ich für super schwach. Keiner wartet anscheinend die Eingabetastatur.
Sollte mein Paket nicht ankommen, muss ich wohl den Betreiber der Packstation in Haftung nehmen.",1,vor 6 Jahren,Konrad Werpuschinski
ChIJwdFmVZlTqEcRmo2JYz4Fia0,DHL Packstation 606,4.2,52.5861418,13.3422716,DHL Packstation,Jederzeit Pakete abgeben ...super Erfindung und einfache Handhabung .,5,vor einem Jahr,Patzy Die
ChIJwdFmVZlTqEcRmo2JYz4Fia0,DHL Packstation 606,4.2,52.5861418,13.3422716,DHL Packstation,"Pakete erhalten und versenden problemlos,Marke Zuhause mit der DHLapp ausgedruckt,als registrierter bei der Paketstation bekommt man einen Einlieferungs Beleg aufs Handy,man kann das Paket nachverfolgen und sieht ob es abgeholt wurde",5,vor 4 Jahren,Heinz Gerhardt
ChIJwdFmVZlTqEcRmo2JYz4Fia0,DHL Packstation 606,4.2,52.5861418,13.3422716,DHL Packstation,"Klappt immer.
Ist auch noch Schreibwaren Geschäft.",5,vor 10 Monaten,Detti 2.0
ChIJgc7Vp21SqEcRi588NFU0wX8,DHL Packstation 160,2.7,52.56695999999999,13.41112,DHL Packstation,"DHL völlig unfähig: Diese Station, die 225 beim Penny und die 205 beim Rewe in Pankow waren nicht nutzbar. Florastraße ist der Bahnhof abgeschlossen gewesen (also nix 24/7 wie angegeben) und bei den anderen beiden stand ausser Betrieb auf dem Display. Leider ist DHL so unfassbar unfähig und hat nicht eine der 3 Stationen in der App als geschlossen abgezeigt – wofür hat man so eine App?! Da hilft auch keine Entschuldigung, das ist Unfähigkeit mit Vorsatz.",1,vor 7 Monaten,Markus Zentek
ChIJgc7Vp21SqEcRi588NFU0wX8,DHL Packstation 160,2.7,52.56695999999999,13.41112,DHL Packstation,"Gut gelegene Packstation, die Sauberkeit ist jedoch aufgrund des Standortes unzureichend.",4,vor 5 Monaten,Viet D. Nguyen
ChIJgc7Vp21SqEcRi588NFU0wX8,DHL Packstation 160,2.7,52.56695999999999,13.41112,DHL Packstation,"Diese Packstation befindet sich im Ausgang des U-Bahnhofes zur Bushaltestelle / Straßenbahnhaltestelle. Leider ist dieser Durchgang sehr zugig, ungemütlich und oft auch dreckig. Weiterhin ist die Packstation sehr gefragt und daher oft belegt. Es ist schon vorgekommen, dass Pakete dann an die nächste Postfiliale mit den entsprechend knappen öffnungszeiten weitergegeben worden sind. Das hat natürlich überhaupt nicht den Sinn der Packstation erfüllt.",3,vor 9 Jahren,Matthias Nebur
ChIJgc7Vp21SqEcRi588NFU0wX8,DHL Packstation 160,2.7,52.56695999999999,13.41112,DHL Packstation,"Könnte sauberer sein. Das Display ist manchmal verschmutzt/mit Flüssigkeiten verklebt, was es ziemlich eklig macht, ein Paket abzuholen.",2,vor 3 Jahren,Marcus Botwin
ChIJgc7Vp21SqEcRi588NFU0wX8,DHL Packstation 160,2.7,52.56695999999999,13.41112,DHL Packstation,Ich habe mich sehr schwer getan das Paket da raus zubekommen,3,vor 8 Jahren,Christiane Tarnowski
ChIJVQor_phTqEcRiP4h8FbhySw,DHL Packstation 706,3,52.5700346,13.4042977,DHL Packstation,"Update: Die Öffnungszeiten sind inzwischen angepasst bei Google. //Die Öffnungszeiten („rund um die Uhr“) sind immer noch falsch. Diese orientieren sich an den Öffnungszeiten des Rathauscenters bzw. an denen von Kaufland (täglich 7-22 Uhr, sonntags geschlossen), ansonsten kommt man nämlich nicht rein ins Center, wo im Untergeschoss die Packstation ist.",5,vor einem Monat,A. S.
ChIJVQor_phTqEcRiP4h8FbhySw,DHL Packstation 706,3,52.5700346,13.4042977,DHL Packstation,"Rund um die Uhr geöffnet ist gelogen. Bin 4 KM umsonst gefahren.
Es ist im Rathaus-Center und man kommt nur zu dessen Öffnungszeiten an die Station :-(",1,vor einem Jahr,R. H.
ChIJVQor_phTqEcRiP4h8FbhySw,DHL Packstation 706,3,52.5700346,13.4042977,DHL Packstation,,1,vor einem Jahr,Sebastian Eichermüller
ChIJVQor_phTqEcRiP4h8FbhySw,DHL Packstation 706,3,52.5700346,13.4042977,DHL Packstation,,5,vor 2 Jahren,S K
ChIJFUqf8W9TqEcRn5ZSyAKWtWU,DHL Packstation 125,4.1,52.560652,13.4137004,DHL Packstation,Super Packstation mit einer netten Nachbarin also einer zweiten Packstation namens 219,5,vor 2 Jahren,David Lorenz
ChIJFUqf8W9TqEcRn5ZSyAKWtWU,DHL Packstation 125,4.1,52.560652,13.4137004,DHL Packstation,Nervig sind die DHL Fahrzeuge die in der Einfahrt stehen obwohl ausreichend Platz zur Verfügung steht 😐,2,vor einem Jahr,Mario Mandla
ChIJFUqf8W9TqEcRn5ZSyAKWtWU,DHL Packstation 125,4.1,52.560652,13.4137004,DHL Packstation,Der Ort ist gut gelegen. Nur nicht immer klappt die Zustellung,5,vor 5 Jahren,Heidi Julich
ChIJFUqf8W9TqEcRn5ZSyAKWtWU,DHL Packstation 125,4.1,52.560652,13.4137004,DHL Packstation,Sehr gut und alles bamte Sehr net,5,vor 4 Jahren,mohamad mankash
ChIJFUqf8W9TqEcRn5ZSyAKWtWU,DHL Packstation 125,4.1,52.560652,13.4137004,DHL Packstation,Halt eine Packstation,2,vor 4 Jahren,Michael Postier
ChIJb2ZY9qhTqEcRMQvILkHovC8,DHL Packstation 547,4.7,52.5737675,13.3985718,DHL Packstation,"Leider ist der Scanner sehr klein und es gibt manchmal Probleme beim scannen des Code, ansonsten ist die packstation richtig groß und da es auf dem Parkplatz vom Lidl ist , ist es prima das man einen Parkplatz hat und entspannt die Station besuchen kann …. Also vielleicht am Scanner noch basteln und dann ist es richtig gut ….",4,vor 4 Jahren,karschulz
ChIJb2ZY9qhTqEcRMQvILkHovC8,DHL Packstation 547,4.7,52.5737675,13.3985718,DHL Packstation,"Diese Packstation ist echt gut erreichbar und auch sehr groß, ich hatte hier noch nie die Situation, dass die Packstation belegt war und auf eine andere ausgewichen werden musste. Es ist auch gut dass wir im Umfeld immer mehr Packstationen bekommen um diese zu entlasten.",5,vor 5 Jahren,Matthias Nebur
ChIJb2ZY9qhTqEcRMQvILkHovC8,DHL Packstation 547,4.7,52.5737675,13.3985718,DHL Packstation,Gut erreichbare und funktionierende Packetstation.,5,vor 2 Jahren,Sebastian Hecht
ChIJb2ZY9qhTqEcRMQvILkHovC8,DHL Packstation 547,4.7,52.5737675,13.3985718,DHL Packstation,Eine super Idee,5,vor 5 Jahren,Axel Priebe
ChIJb2ZY9qhTqEcRMQvILkHovC8,DHL Packstation 547,4.7,52.5737675,13.3985718,DHL Packstation,Zuverlässig und ordentlich,5,vor 5 Jahren,Karell Schlug
ChIJd2DeXuhTqEcRJJml_wNCBlg,DHL Packstation 234,4.3,52.56628560000001,13.3947265,DHL Packstation,"Die Packstation erfüllt ihren Zweck, ist sauber und es gibt immer genügend Platz.
Zudem ist sie gut angebunden.",5,vor 5 Monaten,Viet D. Nguyen
ChIJd2DeXuhTqEcRJJml_wNCBlg,DHL Packstation 234,4.3,52.56628560000001,13.3947265,DHL Packstation,"Was bitte schön soll man an einer Packstation bewerten?
Sie ist groß und gelb. Man kann dort seine Pakete abholen und das funktioniert sogar.
Es gibt einen schönen großen Parkplatz und einen Lebensmitteldiscounter als erfreuliche Zusatzausstattung. Tja nu das kulturelle Angebot ist etwas dürftig, landschaftlich gibt es in der Nähe eine größere Rasenfläche, die Infrastruktur ist gut ausgebaut. Also lets go to the Packstation 👍",3,vor 7 Jahren,Michael Mund
ChIJd2DeXuhTqEcRJJml_wNCBlg,DHL Packstation 234,4.3,52.56628560000001,13.3947265,DHL Packstation,"Parkmöglichkeit - aber Achtung ! Nicht die Parkscheibe vergessen . Sonst wird der Einkauf um 25. Euro teurer . Sehr übersichtlicher Discounter mit DHL - Packstation , sehr gepflegter und sauberer Discounter , gehobene Preisklasse daher einwandfreie Ware , gut sortiert und man findet seine Waren weil nicht andauernt wie bei anderen Discountern umgebaut wird , dadurch spaart man sich die Zeit mit der Sucherei .",4,vor 6 Jahren,Siegfried Flatow
ChIJd2DeXuhTqEcRJJml_wNCBlg,DHL Packstation 234,4.3,52.56628560000001,13.3947265,DHL Packstation,"Sehr oft in der prallen Sonne, sodass man das Display nur erahnen kann. Sehr gute Parkmöglichkeiten.",3,vor 6 Jahren,Andreas Schwarzrock
ChIJd2DeXuhTqEcRJJml_wNCBlg,DHL Packstation 234,4.3,52.56628560000001,13.3947265,DHL Packstation,Ist halt ne Packstation.,4,vor 6 Jahren,To Ba
ChIJv7SAFHZSqEcRpCdlMQOJW2g,DHL Packstation 288,4.3,52.5686073,13.4286246,DHL Packstation,"Sie macht was sie soll. Pakete entgegen nehmen und ausgeben. Keine nennenswerten Probleme in gut 2 Jahren der Nutzung. Lediglich 1 x war die Steuerung / PC , vermutlich abgestürzt, in 2 Jahren ohne irgend ein Problem. Gutes System neben einer Tankstelle.",5,vor 3 Jahren,Shadow Rider
