place_id,name,rating,lat,lng,type,review_text,review_rating,review_time,review_author
ChIJFZ_O0GtSqEcRprKHHecd14Y,Kaufland Berlin-Pankow,4.1,52.5698241,13.4043873,Small retail,"Die Auswahl ist gross und ich habe auch fast immer alles dort bekommen, auch Sonderangebote. Die Mitarbeiter an den Kassen sind immer freundlich....ja, es könnten 5 Sterne sein, aber es gibt nur 1!
Warum? Weil ich es nicht mag, wenn unhygienische Vorfälle für die dortigen Mitarbeiter anscheind kein Problem und vollkommen egal sind. Stattdessen wird man, im unfreundlichen Ton, auch noch angeblafft. Was war passiert? Am SB-Backstand hat ein Mann in das Fach mit den gefüllten Blätterteigstangen gegriffen. Einfach mit den Händen! Er hat nicht etwas die beiden vorderen Stangen gegriffen, sondern ""tastete' sich ganz bis nach hinten durch. Klaro, frische und noch warme Blätterteigstangen schmecken besser als kalte, da muss man alle mal kurz begrapschen, um sich dann für die hinteren Stangen zu entscheiden.  Habe ihn angesprochen und erhielt eine beleidigende Antwort. Er ging mit seinem Einkaufskorb Richtung Kasse und ich ging zum Infostand am Eingang. Das Gespräch, mit der dortigen Mitarbeiterin,  hätte man sich schenken können,  da es sie nicht interessierte.. Sie Lächelt mich nur die ganze Zeit  über gerablassend an und ""blafft"" mich an ""was ist nun das Problem wäre? Was soll ich tun?"" Ähh.. sorry..  ich dachte ihre Mitarbeiter wären in Sachen Hygiene im Lebensmittelbereich geschult und wissen, was zu tun ist.  Ja, sie griff schließlich ihr Telefon und meinte dann, dass sie am Backstand nun  anrufen würde,  damit man die Blätterteigstangen entsorgt. Zeitgleich machte sie eine Handbewegung in meine Richtung,  die besagte, dass ich nun endlich gehen soll ( anders konnte man diese abwertende Handbewegung nicht deuten) ! !ich wollte mich nicht weiter ärgern  und meinen Einkauf beenden.  Mein Einkaufswagen stand noch am Backstand. Als ich dort ankam, war das entsprechende Fach immer noch, mit den Stangen gefüllt. Nach guten 10 Minuten ging ich dann. In dieserZeit hat sich niemand um das Problem gekummert, obwohl die Mitarbeiterin jemanden anrufen wollte, damit man sich darum kümmert.
Absolut enttäuschend,  dass Ihnen Hygiene und die Gesundheit ihrer Kunden egal ist. Gibt zum Glück noch andere Supermarkte zum einkaufen.",1,vor 5 Monaten,Susanne M
ChIJQX4enLtTqEcRXOfclDC3Q5E,Daimi Minimarkt,4.5,52.5653551,13.4046994,Small retail,Sehr freundliche Bedienung. Tolle frische Waren und gute Preise. Alles sauber und gut gepflegt. Wir sind regelmäßig hier und kommen auch gerne immer wieder.,5,vor 2 Jahren,Jana Siegmund
ChIJQX4enLtTqEcRXOfclDC3Q5E,Daimi Minimarkt,4.5,52.5653551,13.4046994,Small retail,"Tolle Familie, toller Inhaber",5,vor 10 Monaten,Michael Postier
ChIJQX4enLtTqEcRXOfclDC3Q5E,Daimi Minimarkt,4.5,52.5653551,13.4046994,Small retail,Lässt sich gut aushalten. Kaffee schmeckt.,4,vor einem Jahr,Gerhard Steffan
ChIJQX4enLtTqEcRXOfclDC3Q5E,Daimi Minimarkt,4.5,52.5653551,13.4046994,Small retail,Die Croissants sind super lecker,5,vor einem Jahr,Nicole
ChIJQX4enLtTqEcRXOfclDC3Q5E,Daimi Minimarkt,4.5,52.5653551,13.4046994,Small retail,sehr viel Auswahl aber schon echt teuer,2,vor 2 Jahren,berlin 030
ChIJR9T4UhNTqEcRXBmsf6WrsVY,REWE,4.3,52.5494582,13.4157815,Small retail,"Nie wieder! Ich hatte mich nach fast einem Jahr Umbauzeit auf den neuen Supermarkt gefreut. Kurz nach der Eröffnung begann die Phase in der mehr und mehr Produkte, auch über Wochen, nicht mehr in den Regalen zu finden waren. Lücken im Angebot sind die Normalität. Ständig wechselndes, unfreundliches/ desinteressiertes und inkompetentes Personal ebenfalls. Nun erlebte ich die Krönung am letzten Samstag. Fast 2 Stunden vor Schließung gab es kein Obst- und Gemüse mehr. Hierzu vermitteln die beigefügten Fotos den entsprechenden Eindruck. Ich werde nun wieder zu dem weiter entfernten, aber in alle Punkten qualitativ deutlich besser aufgestellten Rewe in der Schivelbeiner Straße gehen um einzukaufen.

@ Rewe: Bitte sparen Sie sich den nichts aussagenden und die erneute Arbeitslast( bitte schreiben Sie eine Email an ….)  auf den Kunden übertragende schriftliche Reaktion, die hier unter jeder kritischen Bewertung steht. Allein diese normierte Reaktion zeigt Ihr Desinteresse mehr als deutlich!",1,vor 6 Monaten,till keunt
ChIJR9T4UhNTqEcRXBmsf6WrsVY,REWE,4.3,52.5494582,13.4157815,Small retail,"Also irgendwer hat den Laden nicht im Griff. Eigentlich ein schöner, moderner Rewe. Aber ich stand hier schon mehrfach vor einer fast leeren Obst-und Gemüseabteilung. Auch an anderen Stellen sieht man in den Abendstunden leere Regale.",2,vor 2 Monaten,Philipp Schulze
ChIJR9T4UhNTqEcRXBmsf6WrsVY,REWE,4.3,52.5494582,13.4157815,Small retail,Der Laden ist echt unterirdisch. Regelmäßig faules Obst und Gemüse. Mittlerweile sind die Regale leer.,1,vor einem Monat,Thomas Richter
ChIJR9T4UhNTqEcRXBmsf6WrsVY,REWE,4.3,52.5494582,13.4157815,Small retail,"Ich finde den Dehli super und die charmante und berlinische Bedienung. Das Sortiment ist sehr groß und sie haben sogar einen Sushiladen, der manchmal für 10 Euro Rettertüten hat. Mittlerweile haben sie im Getränkekühlschrank sogar gekühltes alkoholfreies Bier, was mich sehr freut, da ich nicht immer Lust auf eine kalte Limo habe.",4,vor einem Monat,Mona Freier
ChIJR9T4UhNTqEcRXBmsf6WrsVY,REWE,4.3,52.5494582,13.4157815,Small retail,"Ich finde diesen Rewe auch einfach unzumutbar. Ich hab selten so unfreundliches Personal erlebt wie hier. Sie sollten über eine Personalumgestaltung nachdenken. Wenn ich hier einkaufen gehe, nur äußerst ungern.

Ganz unabhängig von meiner eigenen Bewertung hier: fällt dem Rewe hier eigentlich auf, das die nur überwiegend negative Bewertungen kassieren! Soviele Bewerter können Sie nicht irren!

Sie sollten dringend was ändern!",1,vor einem Monat,Sven
ChIJaTnH9wNOqEcRZV0RDm0JF5s,Mirlav Mini Markt,4.6,52.5347993,13.4212244,Small retail,"Der bestsortierte Späti den ich kenne! Ein Wahnsinnssortiment mit zig Barilla-Pastasorten, spannenden Konserven, erstklassigem Gemüse und Früchten, Gewürzen und Toilettenartikeln bis hin zu Crushed Eis, iPhone-Ladegeräten und... Kondomen.",5,vor 5 Jahren,Reginald Gruenenberg
ChIJaTnH9wNOqEcRZV0RDm0JF5s,Mirlav Mini Markt,4.6,52.5347993,13.4212244,Small retail,"Großes, vielfältiges Sortiment für den täglichen Bedarf. Stets frisches Obst und Gemüse und feine Leckereien. Sehr freundlicher Inhaber. Empfehlung!",5,vor 4 Jahren,Sandra Wenzl
ChIJaTnH9wNOqEcRZV0RDm0JF5s,Mirlav Mini Markt,4.6,52.5347993,13.4212244,Small retail,Sehr gut weil man alles bekommt 5 STERNE,5,vor 8 Jahren,Vincent
ChIJaTnH9wNOqEcRZV0RDm0JF5s,Mirlav Mini Markt,4.6,52.5347993,13.4212244,Small retail,Sehr gute Auswahl an Obst und Gemüse! Top!,5,vor 7 Jahren,Felix Wunderlich
ChIJaTnH9wNOqEcRZV0RDm0JF5s,Mirlav Mini Markt,4.6,52.5347993,13.4212244,Small retail,Sehr nett,5,vor 2 Jahren,Ahmad Alshami
ChIJpVjJa1NMqEcRi8to82IlSD8,REWE,3.8,52.5696388,13.4947442,Small retail,"Ich bin echt enttäuscht. Ich habe gestern saure Gurken gekauft und sie heute gegessen. Der Geschmack war so komisch, dass ich auf das Datum geschaut habe – und dann der Schock: seit dem 15.08.2025 abgelaufen. Sowas darf einfach nicht passieren.

Das ist leider auch nicht das erste Mal. In meinen letzten Einkäufen war immer wieder irgendwas dabei, das entweder abgelaufen oder sogar schon verschimmelt war. Man verlässt sich darauf, dass die Ware im Laden kontrolliert wird, und genau das scheint hier nicht zu passieren.

Sehr ärgerlich und absolut kein Vertrauen mehr. Ich werde in Zukunft deutlich genauer hinschauen – oder mir überlegen, woanders einzukaufen.",1,vor einem Monat,Lilly Aileen Krüger
ChIJpVjJa1NMqEcRi8to82IlSD8,REWE,3.8,52.5696388,13.4947442,Small retail,"Das Personal wirkt häufig überlastet, was sich leider auch in der Ordnung und Hygiene der Regale bemerkbar macht. Schade, dass hier offenbar kein ausreichendes Augenmerk darauf gelegt wird. Wie auf dem Bild zu sehen ist, liegen manche Produkte offenbar schon länger dort und sind bereits verschimmelt.",2,vor 3 Monaten,Dennis Mangels
ChIJpVjJa1NMqEcRi8to82IlSD8,REWE,3.8,52.5696388,13.4947442,Small retail,"""Sehr geehrtes Rewe-Team, ich möchte meine Verwunderung und Enttäuschung über eine kürzliche Erfahrung in Ihrer Filiale zum Ausdruck bringen. Während meines Einkaufs mit meinem Sohn wurde ich darauf hingewiesen, ihn in eine Sitzvorrichtung zu setzen, mit dem Hinweis, dass er möglicherweise schmutzig sein könnte, etwa durch Hundekot. Gleichzeitig stelle ich jedoch fest, dass vor der Filiale gravierendere Hygieneprobleme bestehen, etwa durch Personen, die dort ihren Müll hinterlassen oder sogar gegen die Einkaufswagen urinieren. Es erscheint mir daher unverständlich, dass in Bezug auf mein Kind ein so strenger Fokus liegt, während andere, deutlich gravierendere Probleme nicht ausreichend berücksichtigt werden. Ich bitte Sie daher, die Prioritäten entsprechend anzupassen.",2,vor 5 Monaten,Karolin Schmidt
ChIJpVjJa1NMqEcRi8to82IlSD8,REWE,3.8,52.5696388,13.4947442,Small retail,"Der Rewe in der Ribnitzer ist immer gut besucht und trotz dessen, sind die Kassen nicht länger als 5 Meter. Die Mitarbeiter sind alle sehr freundlich",5,vor 2 Jahren,Oguzhan Mercan
ChIJpVjJa1NMqEcRi8to82IlSD8,REWE,3.8,52.5696388,13.4947442,Small retail,"Der Laden sieht immer schlimmer aus aber das macht nichts. Der Stammtisch vor dem Laden holt das alles wieder raus. Ab 18 Uhr live Musik und Karaoke auch gerne mal etwas unpolitisch.
Alle halbe Stunde kommt ein Mittarbeiter vorbei und nimmt Bestellungen an.
Hier verbringt man gerne sein Wochenende.
Leider ein Stern Abzug da die Bar schon um 22:00 schließt.",4,vor einem Jahr,Robert Büchler
ChIJryyzfWNOqEcRdKxs9KjZk-c,Kaufland Berlin H.-Blankenstein-Str,4.2,52.5240105,13.461711,Small retail,"Der Kaufland ist wirklich recht groß ( aber es gibt größere) und bietet eine große Auswahl an Produkten. Man findet eigentlich alles, was man braucht. Besonders positiv finde ich die Obst und Gemüseabteilung, die Ware wirkt immer frisch, und ich habe bisher noch kein verdorbenes Obst oder Gemüse gesehen. Man merkt, dass dort regelmäßig kontrolliert und nachgefüllt wird.
Auch insgesamt wird versucht, den Markt sauber und ordentlich zu halten. Die Mitarbeitenden im Laden sind hilfsbereit und freundlich. Wenn man eine Frage hat, bekommt man in der Regel eine nette und höfliche Antwort, was für eine angenehme Atmosphäre sorgt.
Ein kleiner Minuspunkt sind für mich allerdings die Kassen. Dort wirkt das Personal teilweise etwas unmotiviert oder gestresst, und man fühlt sich manchmal nicht besonders willkommen. Ein freundlicherer Umgang an der Kasse würde das Einkaufserlebnis deutlich verbessern.
Insgesamt aber ein guter, großer Markt mit viel Auswahl und frischen Produkten.",4,vor einem Monat,Lidia
ChIJryyzfWNOqEcRdKxs9KjZk-c,Kaufland Berlin H.-Blankenstein-Str,4.2,52.5240105,13.461711,Small retail,"Meine ganze Familie mag diesen Markt. Wir finden alle Artikel. Naja oftmals sind die Angebote so schnell nicht mehr da! Könnte vielleichtnach gebessert werden.  Wenn wir Fragen haben, sind immer höfliche antworten parat! Auch an der Kasse sind die Mitarbeiter super toll♥️
Wir bleiben genau diesen Markt treu! ✌🏻♥️",5,vor 2 Monaten,P “Goldlocke” K
ChIJryyzfWNOqEcRdKxs9KjZk-c,Kaufland Berlin H.-Blankenstein-Str,4.2,52.5240105,13.461711,Small retail,"Am 13.02.2026 um 22:50 Uhr war nur Kasse Nr. 6 geöffnet und die Schlange war sehr lang.
Ich habe einen Mitarbeiter freundlich gefragt, warum keine weiteren Kassen geöffnet werden. Leider war seine Reaktion sehr unhöflich und desinteressiert. Er sagte nur: „Ich sehe das selbst“ und zeigte keinerlei Bereitschaft zu helfen.

Ich finde dieses Verhalten gegenüber Kunden sehr enttäuschend und hoffe, dass Sie solchen Situationen in Zukunft mehr Aufmerksamkeit schenken.",1,vor einem Monat,Farhad Yusefi
ChIJryyzfWNOqEcRdKxs9KjZk-c,Kaufland Berlin H.-Blankenstein-Str,4.2,52.5240105,13.461711,Small retail,"Ich komme regelmäßig in den Kaufland an der H. Blankenstein Straße, weil er direkt in meiner Nähe liegt und für den täglichen Einkauf sehr praktisch ist. Der Markt bietet eine solide Auswahl an Lebensmitteln und Haushaltsartikeln, also alles, was man im Alltag schnell braucht. Die Wege sind übersichtlich, man findet sich einfach zurecht, und der Einkauf geht ohne großen Aufwand.

Für mich ist es ein ganz normales, funktionales Einkaufserlebnis. Es gibt nichts besonders Hervorstechendes, aber auch nichts Negatives. Der Markt erfüllt genau das, was man von einem Supermarkt erwartet: zuverlässig geöffnet, ausreichend sortiert und bequem erreichbar. Wenn man etwas für den Haushalt oder für den täglichen Bedarf braucht, ist dieser Kaufland eine gute und unkomplizierte Anlaufstelle.",3,vor 4 Monaten,Lineo
ChIJryyzfWNOqEcRdKxs9KjZk-c,Kaufland Berlin H.-Blankenstein-Str,4.2,52.5240105,13.461711,Small retail,"Geht gerade noch so, aber ich gehe mittlerweile oft woanders hin. Die Gründe: oft lange Schlange an den Kassen (am besten gleich schauen, ob die Kunden mal wieder bis zur Kosmetikabteilung stehen, dann lohnt es das Warten nicht), Einkaufstrolleys manchmal schwer zu finden, Regale scheinen nicht regelmäßig neu aufgefüllt werden (fällt mir vor allem bei Milch & Co auf, da sind die Waren bei der Konkurrenz in der Nähe frischer), Waren scheinen häufig neu woanders gestellt zu werden, was den Suchaufwand erhöht und kostet Zeit.",2,vor 5 Monaten,Klaus Tönnies
ChIJU-10ZjlMqEcRqX9qp1WCi-M,Kaufland Berlin-Alt-Hohenschönhaus.,4.1,52.5482784,13.5034572,Small retail,"Für den kleinen Einkauf ist dieser Laden gut.
Man kann hier auch wenn man nicht warten will an die Sb - Kassen gehen.  Das schöne ist es gibt noch ein zweiten kleinen Discounter und eine Drogerie. 2 Punktabzüge. Die WC's, nicht sehr sauber. Nie ist Papier da oder Klo's sind unten voll gematzt. Papierhalter unten wo das Papier raushängen sollte ist auch voll gematzt.   Fließen verschmiert es riecht nach Urin. Und die Türen sind defekt. Und wenn ich Händewaschen möchte, drücke ich den Wasserhahn und es kommt nur kurz Wasser raus. Nirgends kann ich Jacke und Tasche anhängen/ stellen ohne das es nass wird.",3,vor einem Monat,UlRike
ChIJU-10ZjlMqEcRqX9qp1WCi-M,Kaufland Berlin-Alt-Hohenschönhaus.,4.1,52.5482784,13.5034572,Small retail,"Irreführende Preisauszeichnung, da zwei verschiedene Preise über der Ware angebracht waren. Einer davon sehr günstig, aber auf dem Kassenbon ein Anderer, was ich am Infostand beanstandet habe. Antwort der genervten und unfreundlichen Mitarbeiterin ""Da war schon eine Kundin vor Ihnen da, die das beanstandet hat. Die Kollegin hat nachgeschaut, der Preis ist korrekt. Sie müssen richtig lesen.""                                                       Auf meine Reaktion hin ""Ich muss nicht alles Kleingedruckte lesen. Offensichtlich bin ich ja nicht die erste Dumme die nicht richtig lesen kann"" kam                                                                   ""Nein, die Zweite.""  Absolut frech und beleidigend.                                                                                                 Anbei sende ich Details zur Preisauszeichnung, die gerne an die Dame, die dort eindeutig fehl besetzt ist, und andere Mitarbeitende weitergegeben werden können.                                 Ich weiß, das gutes Personal schwer zu finden ist und wir Kunden uns auf die 2. + 3. Wahl einstellen sollten,  da Mangel an Fachpersonal besteht.
Der/die Einäugige unter den Blinden ist nun der/die König:in, dadurch leidet der Kundenservice immer mehr, aber irgendwann ist auch meine Geduld am Ende.                                                                               Und: Der Ton macht die Musik.                                                         PS: Es gibt auch eine Hand voll tolle Mitarbeiterinnen in der Filiale.",1,vor einem Monat,Sanni
ChIJU-10ZjlMqEcRqX9qp1WCi-M,Kaufland Berlin-Alt-Hohenschönhaus.,4.1,52.5482784,13.5034572,Small retail,"Heute war ich in diesem Supermarkt einkaufen. Zufällig habe ich gesehen, dass das Produkt Omega-3 Seefischöl 1000 (80 Kapseln) im Angebot war, und ich wollte mehrere Packungen als Geschenk kaufen. Vor ein paar Wochen war ich auch schon hier einkaufen, deshalb bin ich heute extra wiedergekommen.

Leider war ich sehr enttäuscht von der Einstellung der Kassiererin. Sie hat gerade die Schicht von einem männlichen Kollegen übernommen. Zuerst dachte ich, es gäbe kein Problem, aber ihr Verhalten war sehr unfreundlich und respektlos.

Sie ist aufgestanden, hat meine Ware gezählt (ich wollte etwa 10 Packungen kaufen) und mir in einem unhöflichen Ton gesagt, dass ich nur 3 Packungen kaufen darf und keine weiteren. Außerdem meinte sie, wenn ich mehr kaufen möchte, solle ich in die Apotheke gehen. Besonders schockierend war, dass sie sogar gesagt hat, ich dürfe nicht wiederkommen, um dieses Produkt zu kaufen.

Mir war nicht bekannt, dass es eine Regel gibt, nach der man pro Person nur drei Packungen kaufen darf. Es gab keinerlei Hinweis oder Schild am Regal, das diese Begrenzung erklärt. Wenn Kundinnen oder Kunden eine solche Regel nicht kennen, sollte eine Mitarbeiterin das freundlich erklären und den Grund nennen, anstatt genervt, gereizt und abweisend zu reagieren.

Als Kunde fühlt man sich in so einer Situation nicht respektiert und sehr schlecht behandelt. Ein solches Verhalten ist für mich nicht nachvollziehbar und entspricht nicht dem Service, den man von einem großen Supermarkt erwartet.",1,vor 2 Monaten,ngọc nguyễn
ChIJU-10ZjlMqEcRqX9qp1WCi-M,Kaufland Berlin-Alt-Hohenschönhaus.,4.1,52.5482784,13.5034572,Small retail,"In meinen Augen leider eine Filiale von Kaufland, welche ich bis dato absolut nicht mehr schön finde.
Das Personal meistens einfach nur unfreundlich, genervt, gestresst und in keinsterweise kundenorientiert bzw. Kundenfreundlich.
Ich habe für alles Verständnis, auch wenn viel zu tun ist, zu wenig Personal vorhanden ist, oder oder oder, aber dennoch kann man z.B an der Kasse mit einem ""Hallo"" oder meinetwegen auch einem ""Hi"" beginnen.
Stellt man eine Frage, bekommt man in der Regel eine genervte Antwort.
Es kam nun in den letzten Wochen einmal vor, das wir eine wirklich nette, kompetente, hilfsbereite und kundenorientierte Mitarbeiterin an der Kasse hatten, welche sich auch für den Moment mal die Zeit genommen hat, da sie merkte und sah, das wir diverse Einschränkungen haben.
Oftmals sind die Angebote garnicht dort ausgelegt oder zu finden, oder aber auch aufgrund der minimalen Anzahl direkt vergriffen.
Auch die Sauberkeit ist in dieser Filiale manchmal etwas nachlässig.
Leider hat die Filiale, aus meiner Sicht, stark nachgelassen.",2,vor 3 Monaten,JeMoi97
ChIJU-10ZjlMqEcRqX9qp1WCi-M,Kaufland Berlin-Alt-Hohenschönhaus.,4.1,52.5482784,13.5034572,Small retail,"Kaufland ist super, gehe gerne ins kaufland. Aber in dieses nicht mehr. Grund hierfür ist das unfreundliche Personal, Kundenunfreundlich statt Kundenfreundlich. Besonders an den SB Kassen, da wurden wir auch unteranderem angepammt, dass ich lieber hätte alles stehen gelassen und wäre raus ohne was zu kaufen.",1,vor 4 Monaten,Skoda Octavia
ChIJKSa4IDlPqEcRikbIAkXqwEc,REWE To Go,3.7,52.5064065,13.4501237,Small retail,"Heute im Rewe to Go gewesen
Die Kassiererin tan mir so leid Riesen Schlange
Kassen abgestürzt trotzdem super freundlich gewesen obwohl manche keinen Verständnis hatten !

Ich hoffe Sie als Firma wissen Ihre Mitarbeiter zu schätzen

Einen riesien Respekt trotz der Situation so freundlich zu bleiben.",5,vor 4 Monaten,Steve Hütt
ChIJKSa4IDlPqEcRikbIAkXqwEc,REWE To Go,3.7,52.5064065,13.4501237,Small retail,"Die weiblichen Angestellten waren sehr freundlich, aber heute um 9:20 Uhr wollte mich der männliche Angestellte nicht einmal begrüßen; er wollte nicht, dass ich an seiner Kasse bezahle.nie wiede",1,vor 3 Monaten,Tuấn Phạm Anh
ChIJKSa4IDlPqEcRikbIAkXqwEc,REWE To Go,3.7,52.5064065,13.4501237,Small retail,Klein aber fein. Reicht für Getränke und Backwaren. Als Reisekiosk und späti reicht der aus. Allerdings auch teurer als andere. Tut was er soll.,4,vor 2 Monaten,Chris Chris
ChIJKSa4IDlPqEcRikbIAkXqwEc,REWE To Go,3.7,52.5064065,13.4501237,Small retail,"Der [...] Mitarbeiter nachts ist mal oberfreundlich und sweet. Allein für ihn 5 Sterne mit Luftküsschen.
(Auf Wunsch des Unternehmens editiert)",5,vor 5 Monaten,Cafe Fakov
ChIJKSa4IDlPqEcRikbIAkXqwEc,REWE To Go,3.7,52.5064065,13.4501237,Small retail,Ich war dort in der Nähe habe eine Frage gestellt ob man bei ihnen mit Bargeld bezahlen kann und mir wurde sehr nett geantwortet und ich finde es wirklich super das es so nettes Personal noch gibt,5,vor 3 Monaten,Kevin Muth
ChIJO9sE39BRqEcR3qmk7xtw3bs,City Supermarkt,2.9,52.5094205,13.3917191,Small retail,"Unfassbar schlechter Service! Würde hier niemals teure Pakete hinbestellen. Pakete liegen auf einem Haufen und muss man sich selber suchen (und könnte auch jeder klauen, ohne dass der Besitzer es merkt). Besitzer spricht kein Wort mit einem und hängt uninteressiert am Handy.",1,vor 12 Monaten,Mareike D.
ChIJO9sE39BRqEcR3qmk7xtw3bs,City Supermarkt,2.9,52.5094205,13.3917191,Small retail,Zusatzgebühren bei Kartenzahlung sind nicht zulässig und verboten. Man sollte Anzeige bei der Polizei erstatten.,1,vor einem Jahr,Peter Lustig
ChIJO9sE39BRqEcR3qmk7xtw3bs,City Supermarkt,2.9,52.5094205,13.3917191,Small retail,"Also... was kann man dazu sagen... total unfreundlich, der Inhaber (?) sitzt an der Glotze und hat überhaupt keinen Bock darauf, mit den Kunden zu kommunizieren - mindestens ein ""Guten Tag"" wäre ja ab und zu schön.  Überhaupt nicht empfehlenswert...",1,vor 7 Jahren,Petru Săteanu
ChIJO9sE39BRqEcR3qmk7xtw3bs,City Supermarkt,2.9,52.5094205,13.3917191,Small retail,"Weil keines der Mitarbeiter dort deutsch sprechen kann und zudem noch nicht mal im Stande sind eine Retour einzubuchen. Als sie nicht mehr weiter wussten, haben die mich nach 50 Min warten einfach aus dem Laden geschmissen?!?!? Hallo?? So ein ***laden! Was für ein miserabler Service! Da musste ich selber noch bei Hermes anrufen damit er sich da anhören soll was zu tun ist und hat dann noch nicht einmal reagiert! Einfach nur schlecht!
SCHLECHTESTER HERMES PAKETSHOP",1,vor 9 Jahren,Yumimi Kanto
ChIJO9sE39BRqEcR3qmk7xtw3bs,City Supermarkt,2.9,52.5094205,13.3917191,Small retail,"Leider nimmt man es mit dem Mindesthaltbarkeitsdatum nicht so genau. Jedes zweite Produkt ist abgelaufen, ein Kollege hatte auch schon Maden in seinem Camembert Käse. Also bitte genau aufpassen.

Der Besitzer spricht kaum deutsch, das Rückgeld sollte man kontrollieren.
Alles in allem: echt enttäuschend.",1,vor 8 Jahren,Dave Headnut
ChIJbyaoEghRqEcRQCzKsqoIIEA,REWE,3.8,52.5187557,13.3422516,Small retail,"Der wirklich schlimmste Rewe aller Zeiten. Ständig ist alles blockiert, von Auffüllwägen, die aber nur rum stehen. Und das wirklich jeden Tag, zur jeder Zeit. Organisatorisch, das schlimmste, was ich je gesehen habe. Katastrophe. Nur Billigschrott, der auch noch nicht verkauft werden kann, weil jedes 3. Regal komplett unerreichbar ist.",1,vor 2 Monaten,MrStoerte
ChIJbyaoEghRqEcRQCzKsqoIIEA,REWE,3.8,52.5187557,13.3422516,Small retail,"Kaufe gern und oft bei Rewe ein, aber bestimmt nicht mehr bei diesem hier.
Es gibt sicherlich freundliche Mitarbeiter*innen, leider bin ich selbst bisher nicht auf diese gestoßen.
Eine Dame (zwischen 50-60 Jahren), die bei meinen Besuchen immer an der Kasse tätig war, verhält sich jedes mal unfreundlich.
Kein „Hallo“ kein „Tschüss“ oder etwas dergleichen.
Gibt einem kein schönes Gefühl beim Einkauf.
Denken wohl sie können einen behandeln wie sie möchten, nur weil nebenan zwei Schulen sind und viele Schüler*innen vorbeikommen. Was ihnen trotzdem nicht das Recht gibt, protzig zu werden, wenn man „jünger“ aussieht.
Die Lage, insbesondere vor dem Laden,  ist bekanntlich auch nicht einladend. Eher abschreckend.
Schade.",2,vor 4 Monaten,M
ChIJbyaoEghRqEcRQCzKsqoIIEA,REWE,3.8,52.5187557,13.3422516,Small retail,"Die Produkte sind so frisch, lecker und von sehr guter Qualität. Meine Meinung ist: Qualität bedeutet REWE. Kunden loben immer wieder die außergewöhnliche Fleischqualität und die große Auswahl an Produkten, darunter auch vegane Alternativen.",5,vor 2 Monaten,Be Lay
ChIJbyaoEghRqEcRQCzKsqoIIEA,REWE,3.8,52.5187557,13.3422516,Small retail,"Merke: gehe niemals um 18 Uhr dort einkaufen. Leere Regale, leere Blicke der Mitarbeiter an der Kasse, falsches eingeben von Obst, drengelnde Kunden an der Kasse, obwohl 1,5 M Sicherheitsabstand gehalten werden soll, nicht mal bezahlen kann man, da dort schon jemand anderes steht. Bestimmte Chips sind seit einer Woche ausverkauft, trotz bitten diese Nachzubestellen und auch andere zu bestellen und dafür eine Sorte nicht so viel zu bestellen, da diese anscheinend sehr selten gekauft wird (Thema Umschlagshäufigkeit).

Vormittags gehe ich gern dort hin. Da sind die Regale oft noch gefüllt, außer wenn Ware kommt und die Gänge und Regale zugestellt sind mit 2m Hohen Paletten, damit man auch ja nicht irgendwo heran kommt. Beim Obst sollte man aufpassen. Entweder ist es schon zur Hälfte verschimmelt oder es tuts am nächsten Tag.

Einige Mitarbeiter sind wirklich nett und lustig, vor einigen sollte man sich in Acht nehmen, da gern lautstark gelästert wird an der Kasse (über Kunden).

Um schnell mal was zu holen, ist es aber super dort. Und immer noch besser als der Edeka 500m weiter.",3,vor 4 Jahren,Mathias
ChIJbyaoEghRqEcRQCzKsqoIIEA,REWE,3.8,52.5187557,13.3422516,Small retail,Wie immer top Qualität und große Auswahl an Waren und das Personal ist auch sehr freundlich.,5,vor 2 Monaten,Jürgen Montenbruck
